{
  "version": "1.0",
  "generated_from": "C:\\Users\\AKRAMOST\\Documents\\Proyectos_beta\\powerbi-mcp-agent\\docs\\reglas-mcp\\Checklist de Buenas Prácticas Power BI 1.1 7 (1).pdf",
  "rules_count": 36,
  "rules": [
    {
      "title": "Eliminar columnas duplicadas o sin uso en el modelo",
      "description": "No deben existir columnas duplicadas o sin uso dentro del modelo de datos, ya que incrementan el tamano del modelo, consumen memoria y generan ambiguedad en medidas y relaciones. Reduce ademas la confusion del usuario final al ver campos redundantes.",
      "category": "modelo_datos",
      "severity": "alta",
      "check_type": "automatico",
      "detection": "Revisar las columnas de cada tabla en el TMDL/JSON del modelo y comparar con las referencias en medidas, visuales y relaciones para detectar columnas huerfanas o duplicadas.",
      "rationale": "Columnas duplicadas o no usadas consumen memoria RAM y dificultan el mantenimiento y la claridad del modelo.",
      "scope": [
        "tables",
        "columns"
      ],
      "keywords": [
        "columna duplicada",
        "columna sin uso",
        "unused column",
        "duplicate",
        "TMDL"
      ],
      "example_violation": "Una tabla 'Ventas' tiene 'Importe', 'Monto' y 'TotalImporte' con la misma expresion DAX de calculo, donde dos de ellas nunca se usan en medidas ni visuales.",
      "source_chunk": "Duplicidad e ineficiencia de elementos - No tener columnas duplicadas o sin uso en el modelo - Obligatorio - MidPerf",
      "compiled_by": "llm",
      "id": "PBICHK-001"
    },
    {
      "title": "Usar tipos de datos correctos en campos numericos y de fecha",
      "description": "Evitar el uso del tipo de dato Texto (String) en columnas que representan valores numericos o fechas. El tipo texto impide agregaciones eficientes, ocupa mas espacio y bloquea funciones DAX de inteligencia de tiempo.",
      "category": "nomenclatura",
      "severity": "alta",
      "check_type": "automatico",
      "detection": "Inspeccionar la propiedad dataType de cada columna en TMDL/JSON y validar que columnas de fechas y numeros no sean de tipo String.",
      "rationale": "Tipos incorrectos como texto en numeros o fechas degradan el rendimiento y rompen agregaciones y funciones de time intelligence.",
      "scope": [
        "columns"
      ],
      "keywords": [
        "dataType",
        "String",
        "Integer",
        "DateTime",
        "tipo de dato",
        "data type"
      ],
      "example_violation": "La columna 'FechaPedido' esta definida como dataType String en lugar de DateTime, y 'PrecioUnitario' es texto en vez de Decimal.",
      "source_chunk": "Uso de tipos de datos correcto - Evitar el uso de tipo texto en campos numericos o de fecha. - Obligatorio - MidPerf",
      "compiled_by": "llm",
      "id": "PBICHK-002"
    },
    {
      "title": "Evitar relaciones entre columnas de alta cardinalidad",
      "description": "No deben usarse columnas con granularidad muy fina (por ejemplo, timestamp con hora-minuto-segundo) como clave en relaciones, ya que generan cardinalidad extrema, relaciones ineficientes y mayor consumo de memoria.",
      "category": "modelo_datos",
      "severity": "alta",
      "check_type": "automatico",
      "detection": "Revisar las relaciones en TMDL y analizar la cardinalidad (distinctCount) de las columnas involved en fromCardinality/toCardinality y detectar claves tipo timestamp.",
      "rationale": "Las relaciones sobre columnas de alta cardinalidad degradan gravemente el rendimiento del motor y disparan el consumo de memoria.",
      "scope": [
        "relationships",
        "columns"
      ],
      "keywords": [
        "cardinalidad",
        "relationship",
        "timestamp",
        "granularidad",
        "distinctCount"
      ],
      "example_violation": "Relacion 1:* entre 'Ventas'[FechaHoraCompleta] (timestamp al segundo) y 'Calendario'[FechaHoraCompleta] con millones de valores unicos.",
      "source_chunk": "Evitar relacion entre columnas de alta cardinalidad - No utilizar campos de alta granularidad en relaciones (ejemplo: timestamp) - Obligatorio - MidPerf",
      "compiled_by": "llm",
      "id": "PBICHK-003"
    },
    {
      "title": "Usar esquema en estrella en lugar de copo de nieve",
      "description": "Evitar esquemas Snowflake donde las dimensiones se conectan en cadena entre si; se debe preferir un esquema en Estrella donde todas las dimensiones se relacionan solo con la tabla de hechos. Esto mejora el rendimiento de consulta.",
      "category": "modelo_datos",
      "severity": "alta",
      "check_type": "llm",
      "detection": "Analizar el grafo de relaciones en TMDL y detectar cadenas de relacion dimension-a-dimension en lugar de todas las dimensiones conectadas directamente a la fact table.",
      "rationale": "El esquema estrella minimiza joins, mejora la propagacion de filtros y reduce la complejidad del plan de consulta.",
      "scope": [
        "relationships",
        "tables"
      ],
      "keywords": [
        "star schema",
        "snowflake",
        "esquema estrella",
        "relacion",
        "fact table",
        "dimension"
      ],
      "example_violation": "Relacion Producto -> Subcategoria -> Categoria encadenadas, cuando Categoria y Subcategoria deberian ser columnas dentro de la dimension Producto conectadas directo a Ventas.",
      "source_chunk": "Usar un esquema en estrella en lugar de un esquema copo de nieve - Evitar el uso de esquemas Snowflake que sacrifican performance en pro de consistencia - Obligatorio - HiPerf",
      "compiled_by": "llm",
      "id": "PBICHK-004"
    },
    {
      "title": "Ocultar campos no utilizados en la vista de informe",
      "description": "Toda columna que no se utilice en ninguna visualizacion, filtro o slicer debe marcarse como oculta en la vista de informe, para reducir ruido visual, mejorar la experiencia del usuario y proteger campos sensibles.",
      "category": "reporte_visual",
      "severity": "alta",
      "check_type": "automatico",
      "detection": "Revisar la propiedad isHidden o la presencia en el panel de campos en TMDL/JSON y compararla con las columnas efectivamente referenciadas por visuales y filtros.",
      "rationale": "Ocultar columnas no usadas limpia el panel de campos, evita arrastres accidentales y mejora la claridad para el usuario final.",
      "scope": [
        "columns"
      ],
      "keywords": [
        "isHidden",
        "HideFromReportView",
        "ocultar",
        "columna visible",
        "campo oculto"
      ],
      "example_violation": "La tabla 'Cliente' tiene 30 columnas visibles pero solo 5 se usan en reportes; las otras 25 deberian estar marcadas como IsHidden = true.",
      "source_chunk": "Ocultar campos no utilizados en la vista de informe - Todo campo que no se use en una visualizacion debe estar oculto - Obligatorio - HiPerf",
      "compiled_by": "llm",
      "id": "PBICHK-005"
    },
    {
      "title": "Preferir medidas sobre columnas calculadas cuando sea posible",
      "description": "Priorizar el uso de medidas DAX, que se calculan en tiempo de consulta segun el contexto de filtro, por sobre columnas calculadas que se materializan al refrescar el modelo y consumen espacio adicional.",
      "category": "medidas_dax",
      "severity": "baja",
      "check_type": "automatico",
      "detection": "Revisar en TMDL las columnas con propiedad isCalculated = true (calculated columns) y evaluar si la expresion podria convertirse en medida sin perder performance de agregacion.",
      "rationale": "Las medidas se computan on-demand y son mas más ligeras; las columnas calculadas se almacenan y refrescan con el modelo.",
      "scope": [
        "measures",
        "columns"
      ],
      "keywords": [
        "calculated column",
        "medida",
        "measure",
        "isCalculated",
        "columna calculada"
      ],
      "example_violation": "Columna calculada 'Margen' = [Ingresos]-[Costos] en la tabla Ventas, cuando deberia ser una medida DAX para evitar duplicar datos en memoria.",
      "source_chunk": "Usar medidas en lugar de columnas calculadas siempre que sea posible - Priorizar el uso de medidas que se computan en tiempo real - Opcional",
      "compiled_by": "llm",
      "id": "PBICHK-006"
    },
    {
      "title": "Desactivar la opción de fecha/hora automática",
      "description": "Evitar la creación de tablas de tiempo ocultas que se generan automáticamente al activar la opción de fecha/hora automática, ya que degradan el rendimiento del modelo.",
      "category": "rendimiento",
      "severity": "alta",
      "check_type": "automatico",
      "detection": "Verificar la propiedad autoDateTime en el archivo model.tmdl del modelo.",
      "rationale": "Las tablas de tiempo automáticas consumen memoria RAM de forma innecesaria y rara vez se utilizan en producción.",
      "scope": [
        "dataset"
      ],
      "keywords": [
        "autoDateTime",
        "fecha automática",
        "date table",
        "tabla oculta",
        "performance"
      ],
      "example_violation": "Modelo con autoDateTime=true habilitado, creando tablas ocultas por cada columna de fecha existente.",
      "source_chunk": "Performance Desactivar la opción de fecha/hora automática Evitar la creación de tabla de tiempo ocultas que degradan el performance Obligatorio MidPerf",
      "compiled_by": "llm",
      "id": "PBICHK-007"
    },
    {
      "title": "Reducir la precisión de columnas numéricas",
      "description": "Evitar el uso de precisiones (número de decimales o longitud) mayores a las efectivamente utilizadas en las columnas del modelo, optimizando el almacenamiento y la compresión.",
      "category": "modelo_datos",
      "severity": "alta",
      "check_type": "automatico",